{
  "gdSessions": 8,
  "classroomId": "300036",
  "links": [],
  "weeks": [
    { "hasExercise": true, "title": "", "readingMaterial": [], "questions": [], "bonusQuestions": [] },
    { "hasExercise": false, "title": "", "readingMaterial": [], "questions": [], "bonusQuestions": [] },
    { "hasExercise": true, "title": "", "readingMaterial": [], "questions": [], "bonusQuestions": [] },
    { "hasExercise": false, "title": "", "readingMaterial": [], "questions": [], "bonusQuestions": [] },
    { "hasExercise": true, "title": "", "readingMaterial": [], "questions": [], "bonusQuestions": [] },
    { "hasExercise": false, "title": "", "readingMaterial": [], "questions": [], "bonusQuestions": [] },
    { "hasExercise": true, "title": "", "readingMaterial": [], "questions": [], "bonusQuestions": [] },
    { "hasExercise": false, "title": "", "readingMaterial": [], "questions": [], "bonusQuestions": [] }
  ]
}
